{
  "certificate_version": 5,
  "graph": {
    "num_vertices": 20,
    "edges": [
      [1, 11],
      [0, 10],
      [2, 12],
      [10, 19],
      [10, 18],
      [10, 14],
      [10, 11],
      [10, 15],
      [10, 12],
      [10, 16],
      [10, 17],
      [10, 13],
      [11, 19],
      [11, 18],
      [11, 12],
      [11, 13],
      [11, 14],
      [11, 15],
      [11, 16],
      [11, 17],
      [12, 19],
      [12, 13],
      [12, 14],
      [12, 15],
      [12, 16],
      [12, 17],
      [12, 18],
      [13, 14],
      [13, 15],
      [13, 16],
      [13, 17],
      [13, 18],
      [13, 19],
      [14, 17],
      [14, 18],
      [14, 19],
      [14, 16],
      [14, 15],
      [15, 16],
      [15, 17],
      [15, 18],
      [15, 19],
      [16, 18],
      [16, 19],
      [16, 17],
      [17, 18],
      [17, 19],
      [18, 19],
      [0, 8],
      [0, 9],
      [0, 2],
      [0, 3],
      [0, 5],
      [0, 6],
      [0, 7],
      [0, 4],
      [0, 1],
      [1, 4],
      [1, 5],
      [1, 6],
      [1, 7],
      [1, 3],
      [1, 8],
      [1, 2],
      [1, 9],
      [2, 5],
      [2, 6],
      [2, 7],
      [2, 8],
      [2, 4],
      [2, 9],
      [2, 3],
      [3, 7],
      [3, 8],
      [3, 9],
      [3, 6],
      [3, 4],
      [3, 5],
      [4, 5],
      [4, 6],
      [4, 9],
      [4, 7],
      [4, 8],
      [5, 6],
      [5, 7],
      [5, 8],
      [5, 9],
      [6, 7],
      [6, 8],
      [6, 9],
      [7, 9],
      [7, 8],
      [8, 9]
    ]
  },
  "pieces": [
    {
      "edges": [48, 49, 50, 51, 52, 53, 54, 55, 56, 57, 58, 59, 60, 61, 62, 63, 64, 65, 66, 67, 68, 69, 70, 71, 72, 73, 74, 75, 76, 77, 78, 79, 80, 81, 82, 83, 84, 85, 86, 87, 88, 89, 90, 91, 92],
      "vertices": ["0", "1", "2", "3", "4", "5", "6", "7", "8", "9"],
      "local_pmf": {
        "trees": [
          {
            "edges": [51, 60, 63, 72, 80, 83, 87, 89, 91],
            "weight": [1, 5]
          },
          {
            "edges": [50, 52, 53, 56, 61, 64, 69, 81, 88],
            "weight": [1, 5]
          },
          {
            "edges": [48, 58, 66, 68, 71, 74, 76, 78, 84],
            "weight": [1, 5]
          },
          {
            "edges": [49, 62, 65, 73, 75, 79, 86, 90, 92],
            "weight": [1, 5]
          },
          {
            "edges": [54, 55, 57, 59, 67, 70, 77, 82, 85],
            "weight": [1, 5]
          }
        ]
      }
    },
    {
      "edges": [3, 4, 5, 6, 7, 8, 9, 10, 11, 12, 13, 14, 15, 16, 17, 18, 19, 20, 21, 22, 23, 24, 25, 26, 27, 28, 29, 30, 31, 32, 33, 34, 35, 36, 37, 38, 39, 40, 41, 42, 43, 44, 45, 46, 47],
      "vertices": ["0", "1", "2", "3", "4", "5", "6", "7", "8", "9"],
      "local_pmf": {
        "trees": [
          {
            "edges": [6, 18, 23, 28, 31, 35, 38, 46, 47],
            "weight": [1, 5]
          },
          {
            "edges": [4, 16, 21, 26, 32, 34, 36, 41, 44],
            "weight": [1, 5]
          },
          {
            "edges": [5, 7, 14, 22, 25, 29, 30, 43, 45],
            "weight": [1, 5]
          },
          {
            "edges": [9, 10, 12, 17, 20, 27, 37, 40, 42],
            "weight": [1, 5]
          },
          {
            "edges": [3, 8, 11, 13, 15, 19, 24, 33, 39],
            "weight": [1, 5]
          }
        ]
      }
    },
    {
      "edges": [0, 1, 2],
      "vertices": ["0", "1"],
      "local_pmf": {
        "trees": [
          {
            "edges": [2],
            "weight": [1, 3]
          },
          {
            "edges": [0],
            "weight": [1, 3]
          },
          {
            "edges": [1],
            "weight": [1, 3]
          }
        ]
      }
    }
  ],
  "eta": [
    [1, 3],
    [1, 3],
    [1, 3],
    [1, 5],
    [1, 5],
    [1, 5],
    [1, 5],
    [1, 5],
    [1, 5],
    [1, 5],
    [1, 5],
    [1, 5],
    [1, 5],
    [1, 5],
    [1, 5],
    [1, 5],
    [1, 5],
    [1, 5],
    [1, 5],
    [1, 5],
    [1, 5],
    [1, 5],
    [1, 5],
    [1, 5],
    [1, 5],
    [1, 5],
    [1, 5],
    [1, 5],
    [1, 5],
    [1, 5],
    [1, 5],
    [1, 5],
    [1, 5],
    [1, 5],
    [1, 5],
    [1, 5],
    [1, 5],
    [1, 5],
    [1, 5],
    [1, 5],
    [1, 5],
    [1, 5],
    [1, 5],
    [1, 5],
    [1, 5],
    [1, 5],
    [1, 5],
    [1, 5],
    [1, 5],
    [1, 5],
    [1, 5],
    [1, 5],
    [1, 5],
    [1, 5],
    [1, 5],
    [1, 5],
    [1, 5],
    [1, 5],
    [1, 5],
    [1, 5],
    [1, 5],
    [1, 5],
    [1, 5],
    [1, 5],
    [1, 5],
    [1, 5],
    [1, 5],
    [1, 5],
    [1, 5],
    [1, 5],
    [1, 5],
    [1, 5],
    [1, 5],
    [1, 5],
    [1, 5],
    [1, 5],
    [1, 5],
    [1, 5],
    [1, 5],
    [1, 5],
    [1, 5],
    [1, 5],
    [1, 5],
    [1, 5],
    [1, 5],
    [1, 5],
    [1, 5],
    [1, 5],
    [1, 5],
    [1, 5],
    [1, 5],
    [1, 5],
    [1, 5]
  ],
  "rho": [
    [5, 59],
    [5, 59],
    [5, 59],
    [3, 59],
    [3, 59],
    [3, 59],
    [3, 59],
    [3, 59],
    [3, 59],
    [3, 59],
    [3, 59],
    [3, 59],
    [3, 59],
    [3, 59],
    [3, 59],
    [3, 59],
    [3, 59],
    [3, 59],
    [3, 59],
    [3, 59],
    [3, 59],
    [3, 59],
    [3, 59],
    [3, 59],
    [3, 59],
    [3, 59],
    [3, 59],
    [3, 59],
    [3, 59],
    [3, 59],
    [3, 59],
    [3, 59],
    [3, 59],
    [3, 59],
    [3, 59],
    [3, 59],
    [3, 59],
    [3, 59],
    [3, 59],
    [3, 59],
    [3, 59],
    [3, 59],
    [3, 59],
    [3, 59],
    [3, 59],
    [3, 59],
    [3, 59],
    [3, 59],
    [3, 59],
    [3, 59],
    [3, 59],
    [3, 59],
    [3, 59],
    [3, 59],
    [3, 59],
    [3, 59],
    [3, 59],
    [3, 59],
    [3, 59],
    [3, 59],
    [3, 59],
    [3, 59],
    [3, 59],
    [3, 59],
    [3, 59],
    [3, 59],
    [3, 59],
    [3, 59],
    [3, 59],
    [3, 59],
    [3, 59],
    [3, 59],
    [3, 59],
    [3, 59],
    [3, 59],
    [3, 59],
    [3, 59],
    [3, 59],
    [3, 59],
    [3, 59],
    [3, 59],
    [3, 59],
    [3, 59],
    [3, 59],
    [3, 59],
    [3, 59],
    [3, 59],
    [3, 59],
    [3, 59],
    [3, 59],
    [3, 59],
    [3, 59],
    [3, 59]
  ]
}
